{
  "id": "content.legal-header",
  "category": "CONTENT",
  "semantic": {
    "id": "content.legal-header",
    "category": "CONTENT"
  },
  "source": {
    "id": "src.pages.LegalPage.h1@L167",
    "file": "src/pages/LegalPage.jsx",
    "lines": "167-182",
    "tag": "h1"
  },
  "purpose": "Opening of a legal document page (no hero): h1 with slug id, the operator + effective-date line, and the optional intro (sub-processors page) or preamble (DPA) that precedes the first numbered part.",
  "implementedBy": "src/pages/LegalPage.jsx + src/components/legal/outline.js",
  "evidence": [
    "ev.src.legal-header",
    "ev.src.legal-outline",
    "ev.spec.pul.legal-layout",
    "ev.spec.pul.legal-type",
    "ev.src.page-legal",
    "ev.src.page-legal-frame"
  ],
  "retrievalEligible": true,
  "generatedAssetRoles": [],
  "contentSchema": {
    "type": "object",
    "additionalProperties": false,
    "required": [
      "bodyIsPlaceholder",
      "title",
      "anchorId",
      "operatorLine",
      "effectiveDateLine"
    ],
    "properties": {
      "bodyIsPlaceholder": {
        "type": "boolean",
        "const": true
      },
      "title": {
        "type": "string",
        "minLength": 1,
        "maxLength": 56,
        "maxWords": 4
      },
      "anchorId": {
        "type": "string",
        "pattern": "^[a-z0-9][a-z0-9.-]*$"
      },
      "operatorLine": {
        "type": "string",
        "minLength": 1,
        "maxLength": 56,
        "maxWords": 4
      },
      "effectiveDateLine": {
        "type": "string",
        "minLength": 1,
        "maxLength": 84,
        "maxWords": 6
      },
      "intro": {
        "type": "array",
        "items": {
          "oneOf": [
            {
              "type": "object",
              "additionalProperties": false,
              "required": [
                "kind",
                "text"
              ],
              "properties": {
                "kind": {
                  "type": "string",
                  "enum": [
                    "p"
                  ]
                },
                "text": {
                  "type": "string",
                  "minLength": 1,
                  "maxLength": 364,
                  "maxWords": 26
                }
              }
            },
            {
              "type": "object",
              "additionalProperties": false,
              "required": [
                "kind",
                "items"
              ],
              "properties": {
                "kind": {
                  "type": "string",
                  "enum": [
                    "ul"
                  ]
                },
                "items": {
                  "type": "array",
                  "items": {
                    "type": "string",
                    "minLength": 1,
                    "maxLength": 168,
                    "maxWords": 12
                  },
                  "minItems": 1,
                  "maxItems": 8
                }
              }
            },
            {
              "type": "object",
              "additionalProperties": false,
              "required": [
                "kind",
                "columns",
                "rowCount"
              ],
              "properties": {
                "kind": {
                  "type": "string",
                  "enum": [
                    "table"
                  ]
                },
                "columns": {
                  "type": "array",
                  "items": {
                    "type": "string",
                    "minLength": 1,
                    "maxLength": 56,
                    "maxWords": 4
                  },
                  "minItems": 2,
                  "maxItems": 4
                },
                "rowCount": {
                  "type": "integer",
                  "minimum": 1,
                  "maximum": 8
                }
              }
            }
          ]
        },
        "minItems": 0,
        "maxItems": 4
      },
      "preamble": {
        "type": "array",
        "items": {
          "oneOf": [
            {
              "type": "object",
              "additionalProperties": false,
              "required": [
                "kind",
                "text"
              ],
              "properties": {
                "kind": {
                  "type": "string",
                  "enum": [
                    "p"
                  ]
                },
                "text": {
                  "type": "string",
                  "minLength": 1,
                  "maxLength": 364,
                  "maxWords": 26
                }
              }
            },
            {
              "type": "object",
              "additionalProperties": false,
              "required": [
                "kind",
                "items"
              ],
              "properties": {
                "kind": {
                  "type": "string",
                  "enum": [
                    "ul"
                  ]
                },
                "items": {
                  "type": "array",
                  "items": {
                    "type": "string",
                    "minLength": 1,
                    "maxLength": 168,
                    "maxWords": 12
                  },
                  "minItems": 1,
                  "maxItems": 8
                }
              }
            },
            {
              "type": "object",
              "additionalProperties": false,
              "required": [
                "kind",
                "columns",
                "rowCount"
              ],
              "properties": {
                "kind": {
                  "type": "string",
                  "enum": [
                    "table"
                  ]
                },
                "columns": {
                  "type": "array",
                  "items": {
                    "type": "string",
                    "minLength": 1,
                    "maxLength": 56,
                    "maxWords": 4
                  },
                  "minItems": 2,
                  "maxItems": 4
                },
                "rowCount": {
                  "type": "integer",
                  "minimum": 1,
                  "maximum": 8
                }
              }
            }
          ]
        },
        "minItems": 0,
        "maxItems": 4
      }
    }
  },
  "variants": [],
  "motion": {
    "patterns": {
      "anchor-smooth-scroll": {
        "allowedFallbacks": [
          "unhandled-in-source"
        ],
        "description": "No entrance/scroll animation; in-page anchors smooth-scroll 1000ms and land 40px below the top (scroll-mt-10).",
        "evidence": [
          "ev.spec.pul.legal-behaviour",
          "ev.src.anchor-scroll"
        ]
      }
    }
  },
  "constraints": {
    "onePerPage": true,
    "mustFollowGridFrame": true
  },
  "responsive": [
    {
      "at": "base",
      "change": "frame padding 48/16, h1 32/38.4, h2 20/24, tables become divided card lists"
    },
    {
      "at": "md",
      "change": "padding 64/24, h1 48/52.8, h2 24/28.8, real tables"
    },
    {
      "at": "lg",
      "change": "padding 80"
    },
    {
      "at": "xl",
      "change": "padding x 56"
    },
    {
      "at": "uk",
      "change": "h1/h2 hyphens auto"
    }
  ],
  "accessibility": {
    "headings": "h1 id = document slug; the operator name is the strong first line"
  },
  "example": {
    "bodyIsPlaceholder": true,
    "title": "Placeholder legal document",
    "anchorId": "placeholder-document",
    "operatorLine": "Example Co",
    "effectiveDateLine": "Effective date: placeholder",
    "intro": [
      {
        "kind": "p",
        "text": "Placeholder introduction. Replace with text approved by counsel."
      }
    ]
  },
  "notes": "CLONE-ONLY CONTENT: legal body text is placeholder by design (bodyIsPlaceholder const true). Real legal text must come from counsel. Split from the former whole-page content.legal-article (measured 88% of /terms at 1440px)."
}
